feed,title,long_url,short_url
CiscoSecurityAdvisory,Cisco IOS XR Software Unauthorized Information Disclosure Vulnerability,https://tools.cisco.com/security/center/content/CiscoSecurityAdvisory/cisco-sa-ios-infodisc-4mtm9Gyt?vs_f=Cisco%20Security%20Advisory&vs_cat=Security%20Intelligence&vs_type=RSS&vs_p=Cisco%20IOS%20XR%20Software%20Unauthorized%20Information%20Disclosure%20Vulnerability&vs_k=1,https://j.mp/3pMMkce
CiscoSecurityAdvisory,Cisco IOS XR Software IPv6 Flood Denial of Service Vulnerability,https://tools.cisco.com/security/center/content/CiscoSecurityAdvisory/cisco-sa-xripv6-spJem78K?vs_f=Cisco%20Security%20Advisory&vs_cat=Security%20Intelligence&vs_type=RSS&vs_p=Cisco%20IOS%20XR%20Software%20IPv6%20Flood%20Denial%20of%20Service%20Vulnerability&vs_k=1,https://j.mp/3pKfoBb
CiscoSecurityAdvisory,Cisco Webex Meetings and Cisco Webex Meetings Server Software Hyperlink Injection Vulnerability,https://tools.cisco.com/security/center/content/CiscoSecurityAdvisory/cisco-sa-wbx-linkinj-WWZpVqu9?vs_f=Cisco%20Security%20Advisory&vs_cat=Security%20Intelligence&vs_type=RSS&vs_p=Cisco%20Webex%20Meetings%20and%20Cisco%20Webex%20Meetings%20Server%20Software%20Hyperlink%20Injection%20Vulnerability&vs_k=1,https://j.mp/39JhnQM
CiscoSecurityAdvisory,Cisco Unified Computing System Central Software Improper Certificate Validation Vulnerability,https://tools.cisco.com/security/center/content/CiscoSecurityAdvisory/cisco-sa-ucs-invcert-eOpRvCKH?vs_f=Cisco%20Security%20Advisory&vs_cat=Security%20Intelligence&vs_type=RSS&vs_p=Cisco%20Unified%20Computing%20System%20Central%20Software%20Improper%20Certificate%20Validation%20Vulnerability&vs_k=1,https://j.mp/2YDekDv
CiscoSecurityAdvisory,Cisco IOS XR Software SNMP Management Plane Protection ACL Bypass Vulnerability,https://tools.cisco.com/security/center/content/CiscoSecurityAdvisory/cisco-sa-snmp-7MKrW7Nq?vs_f=Cisco%20Security%20Advisory&vs_cat=Security%20Intelligence&vs_type=RSS&vs_p=Cisco%20IOS%20XR%20Software%20SNMP%20Management%20Plane%20Protection%20ACL%20Bypass%20Vulnerability&vs_k=1,https://j.mp/3oMerqG
CiscoSecurityAdvisory,"Cisco Small Business RV160, RV160W, RV260, RV260P, and RV260W VPN Routers Remote Code Execution Vulnerabilities","https://tools.cisco.com/security/center/content/CiscoSecurityAdvisory/cisco-sa-rv160-260-rce-XZeFkNHf?vs_f=Cisco%20Security%20Advisory&vs_cat=Security%20Intelligence&vs_type=RSS&vs_p=Cisco Small%20Business%20RV160,%20RV160W,%20RV260,%20RV260P,%20and%20RV260W%20VPN%20Routers%20Remote%20Code%20Execution%20Vulnerabilities&vs_k=1",https://j.mp/3pXLyJT
CiscoSecurityAdvisory,"Cisco Small Business RV160, RV160W, RV260, RV260P, and RV260W VPN Routers Arbitrary File Write Vulnerabilities","https://tools.cisco.com/security/center/content/CiscoSecurityAdvisory/cisco-sa-rv160-260-filewrite-7x9mnKjn?vs_f=Cisco%20Security%20Advisory&vs_cat=Security%20Intelligence&vs_type=RSS&vs_p=Cisco%20Small%20Business%20RV160,%20RV160W,%20RV260,%20RV260P,%20and%20RV260W%20VPN%20Routers%20Arbitrary%20File%20Write%20Vulnerabilities&vs_k=1",https://j.mp/3oLUUXF
CiscoSecurityAdvisory,Cisco Small Business RV Series Routers Management Interface Remote Command Execution and Denial of Service Vulnerabilities,https://tools.cisco.com/security/center/content/CiscoSecurityAdvisory/cisco-sa-rv-overflow-ghZP68yj?vs_f=Cisco%20Security%20Advisory&vs_cat=Security%20Intelligence&vs_type=RSS&vs_p=Cisco%20Small%20Business%20RV%20Series%20Routers%20Management%20Interface%20Remote%20Command%20Execution%20and%20Denial%20of%20Service%20Vulnerabilities&vs_k=1,https://j.mp/2O2jzum
CiscoSecurityAdvisory,Cisco Small Business RV Series Routers Management Interface Command Injection Vulnerabilities,https://tools.cisco.com/security/center/content/CiscoSecurityAdvisory/cisco-sa-rv-command-inject-BY4c5zd?vs_f=Cisco%20Security%20Advisory&vs_cat=Security%20Intelligence&vs_type=RSS&vs_p=Cisco%20Small%20Business%20RV%20Series%20Routers%20Management%20Interface%20Command%20Injection%20Vulnerabilities&vs_k=1,https://j.mp/2LeKZvU
CiscoSecurityAdvisory,Cisco Managed Services Accelerator Denial of Service Vulnerability,https://tools.cisco.com/security/center/content/CiscoSecurityAdvisory/cisco-sa-msx-dos-4j7sytvU?vs_f=Cisco%20Security%20Advisory&vs_cat=Security%20Intelligence&vs_type=RSS&vs_p=Cisco%20Managed%20Services%20Accelerator%20Denial%20of%20Service%20Vulnerability&vs_k=1,https://j.mp/3pMtwdd
CiscoSecurityAdvisory,Cisco IOS XR and Cisco NX-OS Software IPv6 Access Control List Bypass Vulnerability,https://tools.cisco.com/security/center/content/CiscoSecurityAdvisory/cisco-sa-ipv6-acl-CHgdYk8j?vs_f=Cisco%20Security%20Advisory&vs_cat=Security%20Intelligence&vs_type=RSS&vs_p=Cisco%20IOS%20XR%20and%20Cisco%20NX-OS%20Software%20IPv6%20Access%20Control%20List%20Bypass%20Vulnerability&vs_k=1,https://j.mp/3rjhSqJ
CiscoSecurityAdvisory,Cisco IOS XR Software for Cisco 8000 Series Routers and Network Convergence System 540 Series Routers Image Verification Vulnerabilities,https://tools.cisco.com/security/center/content/CiscoSecurityAdvisory/cisco-sa-ioxr-l-zNhcGCBt?vs_f=Cisco%20Security%20Advisory&vs_cat=Security%20Intelligence&vs_type=RSS&vs_p=Cisco%20IOS%20XR%20Software%20for%20Cisco%208000%20Series%20Routers%20and%20Network%20Convergence%20System%20540%20Series%20Routers%20Image%20Verification%20Vulnerabilities&vs_k=1,https://j.mp/2Lftgo5
CiscoSecurityAdvisory,Cisco IOS XR Software for Cisco 8000 Series Routers and Network Convergence System 540 Series Routers Privilege Escalation Vulnerability,https://tools.cisco.com/security/center/content/CiscoSecurityAdvisory/cisco-sa-iosxr-pe-QpzCAePe?vs_f=Cisco%20Security%20Advisory&vs_cat=Security%20Intelligence&vs_type=RSS&vs_p=Cisco%20IOS%20XR%20Software%20for%20Cisco%208000%20Series%20Routers%20and%20Network%20Convergence%20System%20540%20Series%20Routers%20Privilege%20Escalation%20Vulnerability&vs_k=1,https://j.mp/2LftoE5
CiscoSecurityAdvisory,Cisco IOS XR Software Enf Broker Denial of Service Vulnerability,https://tools.cisco.com/security/center/content/CiscoSecurityAdvisory/cisco-sa-iosxr-dos-WwDdghs2?vs_f=Cisco%20Security%20Advisory&vs_cat=Security%20Intelligence&vs_type=RSS&vs_p=Cisco%20IOS%20XR%20Software%20Enf%20Broker%20Denial%20of%20Service%20Vulnerability&vs_k=1,https://j.mp/36EZC31
