feed,title,long_url,short_url
PacketstormSecurity,Tenda Router Zero-Days Emerge In Spyware Botnet Campaign,https://packetstormsecurity.com/news/view/31639/Tenda-Router-Zero-Days-Emerge-In-Spyware-Botnet-Campaign.html,https://j.mp/34tA1Zd
PacketstormSecurity,H&M Fined For Breaking GDPR Over Employee Surveillance,https://packetstormsecurity.com/news/view/31637/H-M-Fined-For-Breaking-GDPR-Over-Employee-Surveillance.html,https://j.mp/30ECK0H
PacketstormSecurity,Microsoft Says Iranian Hackers Are Exploiting The ZeroLogon Vulnerability,https://packetstormsecurity.com/news/view/31640/Microsoft-Says-Iranian-Hackers-Are-Exploiting-The-ZeroLogon-Vulnerability.html,https://j.mp/36FNa3U
PacketstormSecurity,McAfee Jailed In Spain Awaiting Extradition For Tax Evasion,https://packetstormsecurity.com/news/view/31638/McAfee-Jailed-In-Spain-Awaiting-Extradition-For-Tax-Evasion.html,https://j.mp/36BmOjF
PacketstormSecurity,Recon Informer 1.2,https://packetstormsecurity.com/files/159476/Recon_Informer_v1.2.py.txt,https://j.mp/36yVUZL
