feed,title,long_url,short_url
PacketstormSecurity,Debunking The Election's Most Widespread Voter Fraud Claims,https://packetstormsecurity.com/news/view/31792/Debunking-The-Elections-Most-Widespread-Voter-Fraud-Claims.html,https://j.mp/2UTwLSx
PacketstormSecurity,Telecom Firms Face £100k Daily Fines Over Security,https://packetstormsecurity.com/news/view/31793/Telecom-Firms-Face-100k-Daily-Fines-Over-Security.html,https://j.mp/2UUnlGn
PacketstormSecurity,Hacker Leaks The User Data Of Event Management App Peatix,https://packetstormsecurity.com/news/view/31795/Hacker-Leaks-The-User-Data-Of-Event-Management-App-Peatix.html,https://j.mp/378zuwU
PacketstormSecurity,Critical VMware Zero-Day Bug Allows Command Injection,https://packetstormsecurity.com/news/view/31794/Critical-VMware-Zero-Day-Bug-Allows-Command-Injection.html,https://j.mp/3m0cEhe
PacketstormSecurity,Tesla Hacked And Stolen Again Using Key Fob,https://packetstormsecurity.com/news/view/31791/Tesla-Hacked-And-Stolen-Again-Using-Key-Fob.html,https://j.mp/33c4Q4P
PacketstormSecurity,Apple Security Chief Indicted For Allegedly Trading iPads For Gun Permits,https://packetstormsecurity.com/news/view/31790/Apple-Security-Chief-Indicted-For-Allegedly-Trading-iPads-For-Gun-Permits.html,https://j.mp/371WNsg
