feed,title,long_url,short_url
PacketstormSecurity,SolarWinds Hack Prompts Congress To Put NSA In Encryption Hot Seat,https://packetstormsecurity.com/news/view/31981/SolarWinds-Hack-Prompts-Congress-To-Put-NSA-In-Encryption-Hot-Seat.html,https://j.mp/3oAdK3S
PacketstormSecurity,This Linux Malware Is Hijacking Supercomputers Globally,https://packetstormsecurity.com/news/view/31979/This-Linux-Malware-Is-Hijacking-Supercomputers-Globally.html,https://j.mp/36CtVrb
PacketstormSecurity,Identity Theft Spikes Due To COVID-19 Relief,https://packetstormsecurity.com/news/view/31980/Identity-Theft-Spikes-Due-To-COVID-19-Relief.html,https://j.mp/3reM5qL
PacketstormSecurity,Hackers Are Exploiting A Critical Zero Day In Devices From SonicWall,https://packetstormsecurity.com/news/view/31982/Hackers-Are-Exploiting-A-Critical-Zero-Day-In-Devices-From-SonicWall.html,https://j.mp/2O0zmKb
PacketstormSecurity,Apple Face ID To Work For Mask Wearers,https://packetstormsecurity.com/news/view/31983/Apple-Face-ID-To-Work-For-Mask-Wearers.html,https://j.mp/36zYSw1
