feed,title,long_url,short_url
PacketstormSecurity,"Twitter Gets GDPR Fine Of 450,000 Euros From Ireland",https://packetstormsecurity.com/news/view/31853/Twitter-Gets-GDPR-Fine-Of-450-000-Euros-From-Ireland.html,https://j.mp/2LHSs6F
PacketstormSecurity,FICO Launches Cryptocurrency Trade Risk Solution For Banks,https://packetstormsecurity.com/news/view/31854/FICO-Launches-Cryptocurrency-Trade-Risk-Solution-For-Banks.html,https://j.mp/2KtyLig
PacketstormSecurity,Huawei PR Exec Quits Over Uighur Surveillance Fears,https://packetstormsecurity.com/news/view/31855/Huawei-PR-Exec-Quits-Over-Uighur-Surveillance-Fears.html,https://j.mp/2Wi9lqC
PacketstormSecurity,"Firefox Patches Critical Mystery Bug, Also Impacting Google Chrome",https://packetstormsecurity.com/news/view/31856/Firefox-Patches-Critical-Mystery-Bug-Also-Impacting-Google-Chrome.html,https://j.mp/37ouJk6
PacketstormSecurity,Here Are The Critical Responses Required Of All Businesses After The SolarWinds Supply-Chain Hack,https://packetstormsecurity.com/news/view/31852/Here-Are-The-Critical-Responses-Required-Of-All-Businesses-After-The-SolarWinds-Supply-Chain-Hack.html,https://j.mp/2Wlhc6F
