feed,title,long_url,short_url
r/NetSec,"This man thought opening a TXT file is fine, he thought wrong. macOS CVE-2019-8761",https://redd.it/mkf0wj,
r/NetSec,Caronte: a tool to analyze the network flow during attack/defence CTF,https://redd.it/mjchoc,
r/NetSec,Terramaster NAS exposes itself over the internet using uPnP. Here's how to fix it.,https://redd.it/mjb63z,
r/NetSec,Dirty Tor Exit Node to Bitcoin wallet.dat access Whitepaper (No BTC was actually stolen),https://redd.it/mj5fak,
r/NetSec,"[FBI/CISA] APT Actors Exploit Vulnerabilities to Gain Initial Access for Future Attack - FortiNet/FortiOS - scanning devices on ports 4443, 8443, and 10443 for CVE-2018-13379, and enumerated devices for CVE-2020-12812 and CVE-2019-5591",https://redd.it/mj4icj,
r/NetSec,Zero click vulnerability in Apple’s macOS Mail,https://redd.it/mi6rse,
