feed,title,long_url,short_url
PacketstormSecurity,Hackers Can Use Just-Fixed Intel Bugs To Install Malicious Firmware On PCs,https://packetstormsecurity.com/news/view/31761/Hackers-Can-Use-Just-Fixed-Intel-Bugs-To-Install-Malicious-Firmware-On-PCs.html,https://j.mp/2UwTnrD
PacketstormSecurity,Scams Ramp Up Ahead Of Black Friday Cyber Criminal Craze,https://packetstormsecurity.com/news/view/31762/Scams-Ramp-Up-Ahead-Of-Black-Friday-Cyber-Criminal-Craze.html,https://j.mp/3pxz3Vt
PacketstormSecurity,"Up To 350,000 People's Information Stolen In Capcom Hack",https://packetstormsecurity.com/news/view/31763/Up-To-350-000-Peoples-Information-Stolen-In-Capcom-Hack.html,https://j.mp/3lPdtJX
PacketstormSecurity,Microsoft Is Working On The Kerberos Authentication Bug,https://packetstormsecurity.com/news/view/31764/Microsoft-Is-Working-On-The-Kerberos-Authentication-Bug.html,https://j.mp/38MMVFj
PacketstormSecurity,Lazarus Malware Strikes South Korean Supply Chains,https://packetstormsecurity.com/news/view/31765/Lazarus-Malware-Strikes-South-Korean-Supply-Chains.html,https://j.mp/36VwzI7
