feed,title,long_url,short_url
NVD-NIST,"CVE-2020-16979 (sharepoint_enterprise_server, sharepoint_foundation, sharepoint_server)",https://web.nvd.nist.gov/view/vuln/detail?vulnId=CVE-2020-16979,https://j.mp/3lD8qfq
NVD-NIST,"CVE-2020-17015 (sharepoint_enterprise_server, sharepoint_foundation, sharepoint_server)",https://web.nvd.nist.gov/view/vuln/detail?vulnId=CVE-2020-17015,https://j.mp/32QmvyR
NVD-NIST,"CVE-2020-17016 (sharepoint_enterprise_server, sharepoint_foundation, sharepoint_server)",https://web.nvd.nist.gov/view/vuln/detail?vulnId=CVE-2020-17016,https://j.mp/3f2HGm6
NVD-NIST,"CVE-2020-17017 (sharepoint_enterprise_server, sharepoint_foundation, sharepoint_server)",https://web.nvd.nist.gov/view/vuln/detail?vulnId=CVE-2020-17017,https://j.mp/3kDjIPw
NVD-NIST,CVE-2020-17019 (office),https://web.nvd.nist.gov/view/vuln/detail?vulnId=CVE-2020-17019,https://j.mp/36EVAHf
